{
  "doc": "Extensions/n3sh/layout/keymap.md",
  "source_original": "karabiner_json/_orignal_do-not-update/z_backup/old_history/karabiner-for속기_2026.06.02_최종식3벌_마지막.json",
  "manipulators": [
    {
      "conditions": [
        {
          "input_sources": [
            {
              "language": "^ko$"
            }
          ],
          "type": "input_source_if"
        },
        {
          "name": "keyboardLayoutSettingIsEng",
          "type": "variable_if",
          "value": 0
        }
      ],
      "from": {
        "simultaneous": [
          {
            "key_code": "0"
          },
          {
            "key_code": "2"
          }
        ]
      },
      "to": [
        {
          "key_code": "0"
        },
        {
          "key_code": "e"
        },
        {
          "key_code": "2"
        }
      ],
      "type": "basic"
    },
    {
      "conditions": [
        {
          "input_sources": [
            {
              "language": "^ko$"
            }
          ],
          "type": "input_source_if"
        },
        {
          "name": "keyboardLayoutSettingIsEng",
          "type": "variable_if",
          "value": 0
        }
      ],
      "from": {
        "simultaneous": [
          {
            "key_code": "1"
          },
          {
            "key_code": "w"
          }
        ]
      },
      "to": [
        {
          "key_code": "1",
          "modifiers": "shift"
        }
      ],
      "type": "basic"
    },
    {
      "conditions": [
        {
          "input_sources": [
            {
              "language": "^ko$"
            }
          ],
          "type": "input_source_if"
        },
        {
          "name": "keyboardLayoutSettingIsEng",
          "type": "variable_if",
          "value": 0
        }
      ],
      "from": {
        "simultaneous": [
          {
            "key_code": "2"
          },
          {
            "key_code": "1"
          }
        ]
      },
      "to": [
        {
          "key_code": "2",
          "modifiers": "shift"
        }
      ],
      "type": "basic"
    },
    {
      "conditions": [
        {
          "input_sources": [
            {
              "language": "^ko$"
            }
          ],
          "type": "input_source_if"
        },
        {
          "name": "keyboardLayoutSettingIsEng",
          "type": "variable_if",
          "value": 0
        }
      ],
      "from": {
        "simultaneous": [
          {
            "key_code": "8"
          },
          {
            "key_code": "spacebar"
          }
        ]
      },
      "to": [
        {
          "key_code": "j"
        },
        {
          "key_code": "8"
        },
        {
          "key_code": "spacebar"
        }
      ],
      "type": "basic"
    },
    {
      "conditions": [
        {
          "input_sources": [
            {
              "language": "^ko$"
            }
          ],
          "type": "input_source_if"
        },
        {
          "name": "keyboardLayoutSettingIsEng",
          "type": "variable_if",
          "value": 0
        }
      ],
      "from": {
        "simultaneous": [
          {
            "key_code": "9"
          },
          {
            "key_code": "s"
          }
        ]
      },
      "to": [
        {
          "key_code": "j"
        },
        {
          "key_code": "9"
        },
        {
          "key_code": "d"
        },
        {
          "key_code": "s"
        }
      ],
      "type": "basic"
    },
    {
      "conditions": [
        {
          "input_sources": [
            {
              "language": "^ko$"
            }
          ],
          "type": "input_source_if"
        },
        {
          "name": "keyboardLayoutSettingIsEng",
          "type": "variable_if",
          "value": 0
        }
      ],
      "from": {
        "simultaneous": [
          {
            "key_code": "a"
          },
          {
            "key_code": "w"
          }
        ]
      },
      "to": [
        {
          "key_code": "a",
          "modifiers": "shift"
        }
      ],
      "type": "basic"
    },
    {
      "conditions": [
        {
          "input_sources": [
            {
              "language": "^ko$"
            }
          ],
          "type": "input_source_if"
        },
        {
          "name": "keyboardLayoutSettingIsEng",
          "type": "variable_if",
          "value": 0
        }
      ],
      "from": {
        "simultaneous": [
          {
            "key_code": "c"
          },
          {
            "key_code": "spacebar"
          }
        ]
      },
      "to": [
        {
          "key_code": "9"
        },
        {
          "key_code": "c"
        }
      ],
      "type": "basic"
    },
    {
      "conditions": [
        {
          "input_sources": [
            {
              "language": "^ko$"
            }
          ],
          "type": "input_source_if"
        },
        {
          "name": "keyboardLayoutSettingIsEng",
          "type": "variable_if",
          "value": 0
        }
      ],
      "from": {
        "simultaneous": [
          {
            "key_code": "c"
          },
          {
            "key_code": "v"
          }
        ]
      },
      "to": [
        {
          "key_code": "period"
        },
        {
          "key_code": "spacebar"
        }
      ],
      "type": "basic"
    },
    {
      "conditions": [
        {
          "input_sources": [
            {
              "language": "^ko$"
            }
          ],
          "type": "input_source_if"
        },
        {
          "name": "keyboardLayoutSettingIsEng",
          "type": "variable_if",
          "value": 0
        }
      ],
      "from": {
        "simultaneous": [
          {
            "key_code": "d"
          },
          {
            "key_code": "c"
          }
        ]
      },
      "to": [
        {
          "key_code": "j"
        },
        {
          "key_code": "d"
        },
        {
          "key_code": "spacebar"
        }
      ],
      "type": "basic"
    },
    {
      "conditions": [
        {
          "input_sources": [
            {
              "language": "^ko$"
            }
          ],
          "type": "input_source_if"
        },
        {
          "name": "keyboardLayoutSettingIsEng",
          "type": "variable_if",
          "value": 0
        }
      ],
      "from": {
        "simultaneous": [
          {
            "key_code": "d"
          },
          {
            "key_code": "e"
          }
        ]
      },
      "to": [
        {
          "key_code": "m"
        },
        {
          "key_code": "d"
        },
        {
          "key_code": "spacebar"
        }
      ],
      "type": "basic"
    },
    {
      "conditions": [
        {
          "input_sources": [
            {
              "language": "^ko$"
            }
          ],
          "type": "input_source_if"
        },
        {
          "name": "keyboardLayoutSettingIsEng",
          "type": "variable_if",
          "value": 0
        }
      ],
      "from": {
        "simultaneous": [
          {
            "key_code": "d"
          },
          {
            "key_code": "period"
          }
        ]
      },
      "to": [
        {
          "key_code": "j"
        },
        {
          "key_code": "6"
        },
        {
          "key_code": "period"
        },
        {
          "key_code": "spacebar"
        }
      ],
      "type": "basic"
    },
    {
      "conditions": [
        {
          "input_sources": [
            {
              "language": "^ko$"
            }
          ],
          "type": "input_source_if"
        },
        {
          "name": "keyboardLayoutSettingIsEng",
          "type": "variable_if",
          "value": 0
        }
      ],
      "from": {
        "modifiers": {
          "mandatory": [
            "command"
          ]
        },
        "simultaneous": [
          {
            "key_code": "d"
          },
          {
            "key_code": "period"
          }
        ]
      },
      "to": [
        {
          "key_code": "j"
        },
        {
          "key_code": "6"
        },
        {
          "key_code": "spacebar"
        }
      ],
      "type": "basic"
    },
    {
      "conditions": [
        {
          "input_sources": [
            {
              "language": "^ko$"
            }
          ],
          "type": "input_source_if"
        },
        {
          "name": "keyboardLayoutSettingIsEng",
          "type": "variable_if",
          "value": 0
        }
      ],
      "from": {
        "modifiers": {
          "mandatory": [
            "shift"
          ]
        },
        "simultaneous": [
          {
            "key_code": "d"
          },
          {
            "key_code": "period"
          }
        ]
      },
      "to": [
        {
          "key_code": "j"
        },
        {
          "key_code": "6"
        },
        {
          "key_code": "slash",
          "modifiers": "shift"
        },
        {
          "key_code": "spacebar"
        }
      ],
      "type": "basic"
    },
    {
      "conditions": [
        {
          "input_sources": [
            {
              "language": "^ko$"
            }
          ],
          "type": "input_source_if"
        },
        {
          "name": "keyboardLayoutSettingIsEng",
          "type": "variable_if",
          "value": 0
        }
      ],
      "from": {
        "modifiers": {
          "mandatory": [
            "shift",
            "command"
          ]
        },
        "simultaneous": [
          {
            "key_code": "d"
          },
          {
            "key_code": "period"
          }
        ]
      },
      "to": [
        {
          "key_code": "j"
        },
        {
          "key_code": "6"
        },
        {
          "key_code": "b",
          "modifiers": "shift"
        },
        {
          "key_code": "spacebar"